{
  "id": "M16-W61-D421",
  "week": 61,
  "resources": [],
  "month": 16,
  "evidenceTypes": [],
  "title": "",
  "microLesson": "",
  "activity": "",
  "learningGoal": "",
  "version": "1.0.0",
  "metadata": {
    "sensitivity": "general",
    "language": "en-AU"
  },
  "durationMinutes": 0,
  "caseworkerFlags": [],
  "day": 421,
  "moduleId": "module-16"
}
